Organization Name,Phone Number,Address,Description,Url
Arms of Hope,830-522-2200,"21300 State Highway 16 North, Medina, TX","First-time expecting single mothers",http://www.armsofhope.org/
Gladney Center for Adoption (Dallas),214-887-1292,"1920 McKinney Ave, Dallas, TX","Through pregnancy and adoption process – may stay in dorm with other expectant mothers",https://adoptionsbygladney.com/
Gladney Center for Adoption (Fort Worth),817-922-6000,"6300 John Ryan Dr, Fort Worth, TX","Through pregnancy and adoption process – may stay in dorm with other expectant mothers",https://adoptionsbygladney.com/
Hope Cottage,214-526-8721,"2705 Swiss Ave, Dallas, TX","Parenting support and adoption support",http://hopecottage.org/
In My Shoes,469-857-3264,"P.O. Box 132993, Dallas, TX","Must be 18+ years old",https://www.liveinmyshoes.org/
Mother Teresa’s,214-374-3351,"2727 Harlandale Ave, Dallas, TX","Must be 18+ years or emancipated",http://www.texascda.org/missionariesdallas.php
Promise House: Wesley Inn,214-941-8578,"224 W Page Ave, Dallas, TX","Females, 14-20 years old and pregnant or a teen mom",https://promisehouse.org/
